{
  "brief_id": "SUNRISE-KIDS-TUYENSINH-2026-08",
  "brief_title": "Tuyển sinh khoá Tiếng Anh giao tiếp nền tảng — Sunrise Kids",
  "personas_covered": ["PH1", "PH2", "PH3"],
  "angles": [
    {
      "angle_id": "A-01",
      "nhom": "Mở đầu — nỗi trăn trở của phụ huynh",
      "y_tuong": "Khơi đúng câu phụ huynh PH1 hay nói: con học tiếng Anh ở trường nhiều năm mà gặp người nước ngoài vẫn không dám mở miệng. Đặt câu hỏi vì sao, rồi dẫn tới cách Sunrise Kids để bé được nói trong buổi thay vì ngồi nghe suốt.",
      "chan_dung": "PH1",
      "muc_tieu": "AWARENESS",
      "kenh_phu_hop": ["Fanpage", "TikTok"]
    },
    {
      "angle_id": "A-02",
      "nhom": "Chuyển đổi — mời học thử",
      "y_tuong": "Giảm rủi ro quyết định cho PH1 đang phân vân 'cho học sớm quá chưa': mời học thử 1 buổi trước khi đăng ký, kèm mô tả ngắn bé sẽ làm gì trong 75 phút đó.",
      "chan_dung": "PH1",
      "muc_tieu": "CONVERSION",
      "kenh_phu_hop": ["Fanpage", "TikTok"]
    },
    {
      "angle_id": "A-03",
      "nhom": "Xây niềm tin — đo được tiến bộ",
      "y_tuong": "PH2 sợ nhất là học mà không đo được tiến bộ. Giới thiệu báo cáo tiến độ hàng tháng: bé nói được gì, còn vướng đâu, cần luyện thêm phần nào ở nhà — để phụ huynh không biết tiếng Anh vẫn theo dõi được con.",
      "chan_dung": "PH2",
      "muc_tieu": "TRUST",
      "kenh_phu_hop": ["Fanpage", "TikTok"]
    },
    {
      "angle_id": "A-04",
      "nhom": "Gỡ phản đối — không luyện thi vẫn vững nền tảng",
      "y_tuong": "PH2 đang tính chuyện thi vào trường tốt và sợ 'hai năm nữa có kịp không'. Nói rõ Sunrise Kids không dạy luyện thi, nhưng chính nền giao tiếp vững là thứ giúp con tự tin hơn khi bước vào giai đoạn ôn thi sau này — tránh viết trượt thành cam kết thi cử.",
      "chan_dung": "PH2",
      "muc_tieu": "OBJECTION",
      "kenh_phu_hop": ["Fanpage", "TikTok"]
    },
    {
      "angle_id": "A-05",
      "nhom": "Giáo dục — vì sao lớp nhỏ tạo khác biệt",
      "y_tuong": "PH3 đã thất vọng vì lớp đông, cô không để ý tới con. Giải thích cơ chế cụ thể: lớp tối đa 15 bé, một trợ giảng theo sát cả buổi, nhớ được từng bé đang yếu chỗ nào — con số và cơ chế thay cho lời hứa hẹn.",
      "chan_dung": "PH3",
      "muc_tieu": "EDUCATION",
      "kenh_phu_hop": ["Fanpage", "TikTok"]
    }
  ]
}
